{
  "batch_schema_version": "1.0",
  "batch_id": "approved-public-release-v1",
  "origin_class": "adversarial_synthetic",
  "items": [
    {
      "source_record_key": "rec-acme-101",
      "mention_key": "item-1",
      "source_system": "reviewed_export",
      "observed_at": "2026-09-20T10:00:00Z",
      "posted_at": "2026-09-18T08:00:00Z",
      "source_kind": "official_employer",
      "source_domain": "careers.acme.example.com",
      "job_id": "REQ-101",
      "title": "Principal Rails Systems Architect",
      "company": "Acme Aerospace",
      "location": "Denver, CO",
      "remote_type": "hybrid",
      "employment_type": "full_time",
      "salary": { "min": 175000, "max": 215000, "currency": "USD", "period": "year" },
      "summary_excerpt": "Lead distributed PostgreSQL and Rails data ingestion pipeline architectures.",
      "job_url": "https://careers.acme.example.com/jobs/REQ-101"
    },
    {
      "source_record_key": "rec-acme-101-board",
      "mention_key": "item-1",
      "source_system": "third_party_aggregator",
      "observed_at": "2026-09-22T14:30:00Z",
      "source_kind": "third_party_board",
      "source_domain": "boards.example.net",
      "job_id": "REQ-101",
      "title": "Principal Rails Systems Architect",
      "company": "Acme Aerospace",
      "location": "Denver, CO",
      "remote_type": "hybrid",
      "employment_type": "full_time",
      "salary": { "min": 160000, "max": 200000, "currency": "USD", "period": "year" },
      "summary_excerpt": "Acme Aerospace seeks a Principal Rails Architect in Denver.",
      "job_url": "https://boards.example.net/acme/REQ-101"
    },
    {
      "source_record_key": "rec-acme-102",
      "mention_key": "item-1",
      "source_system": "reviewed_export",
      "observed_at": "2026-09-21T11:00:00Z",
      "posted_at": "2026-09-19T09:00:00Z",
      "source_kind": "official_employer",
      "source_domain": "careers.acme.example.com",
      "job_id": "REQ-102",
      "title": "Principal Rails Systems Architect",
      "company": "Acme Aerospace",
      "location": "Denver, CO",
      "remote_type": "hybrid",
      "employment_type": "full_time",
      "salary": { "min": 180000, "max": 220000, "currency": "USD", "period": "year" },
      "summary_excerpt": "Second identical opening for Space Avionics division.",
      "job_url": "https://careers.acme.example.com/jobs/REQ-102"
    },
    {
      "source_record_key": "rec-globex-201",
      "mention_key": "item-1",
      "source_system": "reviewed_export",
      "observed_at": "2026-09-23T15:00:00Z",
      "source_kind": "third_party_board",
      "source_domain": "techjobs.example.org",
      "job_id": "GX-201",
      "title": "Senior Support API Engineer",
      "company": "Globex Software",
      "location": "Austin, TX",
      "remote_type": "remote",
      "employment_type": "full_time",
      "salary": { "min": 120000, "max": 145000, "currency": "USD", "period": "year" },
      "summary_excerpt": "Troubleshoot customer API integrations and build deterministic search endpoints.",
      "job_url": "https://techjobs.example.org/posting/GX-201"
    },
    {
      "source_record_key": "rec-globex-similar",
      "mention_key": "item-1",
      "source_system": "reviewed_export",
      "observed_at": "2026-09-24T08:00:00Z",
      "source_kind": "email_digest",
      "source_domain": "digest.example.com",
      "job_id": null,
      "title": "Senior Support API Engineer",
      "company": "Globex Software",
      "location": "Austin, TX",
      "remote_type": "remote",
      "employment_type": "full_time",
      "salary": null,
      "summary_excerpt": "Globex is hiring a Senior Support API Engineer in Austin.",
      "job_url": null
    }
  ]
}
